{
  "$schema": "https://json-schema.org/draft/2020-12/schema",
  "$id": "https://github.com/bmcnaboe/careerdocs-plugin/schemas/config.schema.json#1.0.0",
  "title": "careerdocs.json",
  "type": "object",
  "additionalProperties": false,
  "required": ["version"],
  "properties": {
    "version": { "const": "1" },
    "providers": {
      "type": "object", "additionalProperties": false,
      "properties": {
        "authoritative": { "const": "markdown", "default": "markdown" },
        "markdown": { "type": "object", "additionalProperties": false, "properties": { "path": { "type": "string", "default": "profile" } } }
      }
    },
    "templates": { "type": "object", "additionalProperties": false, "properties": { "dir": { "type": "string", "default": "templates" }, "resume": { "type": "string", "default": "resume" }, "cover_letter": { "type": "string", "default": "cover-letter" } } },
    "voice": { "type": "object", "additionalProperties": false, "properties": { "path": { "type": "string", "default": "voice/voice.md" } } },
    "identity": { "type": "object", "additionalProperties": false, "properties": { "path": { "type": "string", "default": "identity/identity.md" } } },
    "outputs": { "type": "object", "additionalProperties": false, "properties": { "applications_dir": { "type": "string", "default": "applications" }, "baselines_dir": { "type": "string", "default": "baselines" }, "file_name": { "type": "string", "default": "{name}-{org}-{role}-{kind}" }, "history": { "enum": ["auto", "git", "archive"], "default": "auto" } } },
    "workflow": {
      "type": "object", "additionalProperties": false,
      "properties": {
        "state_dir": { "type": "string", "default": ".careerdocs/state" },
        "positioning_default": { "enum": ["executive", "builder"], "default": "builder" },
        "page_budget": { "type": "object", "additionalProperties": false, "properties": { "resume": { "type": "integer", "minimum": 1, "default": 2 }, "cover_letter": { "type": "integer", "minimum": 1, "default": 1 } } },
        "approval_mode": { "const": "explicit", "default": "explicit" }
      }
    }
  }
}
